{
  "$schema": "lab.schema.json",
  "schema_version": 1,
  "lab_id": "rag-retrieval",
  "title": "RAG Retrieval Workshop",
  "entrypoints": {
    "human": "README.md",
    "instructions": "AGENTS.md",
    "skill": ".agents/skills/instaclustr-rag-builder/SKILL.md",
    "adaptation": "USING_THE_TEMPLATE.md",
    "architecture": "architecture.md",
    "contracts": "references/agent-contracts.md"
  },
  "environment": {
    "python": {
      "minimum": "3.10",
      "recommended": "3.12"
    },
    "requirements": "support/requirements.txt",
    "config_example": "support/.env.example",
    "config_loader": "support/common/config.py"
  },
  "shared_sources": [
    "support/common/__init__.py",
    "support/common/config.py",
    "support/common/embeddings.py",
    "support/common/labels.py",
    "support/common/llm_client.py",
    "support/common/logging.py",
    "support/common/ner_client.py",
    "support/common/opensearch_client.py",
    "support/recipes/recipes_sample.json"
  ],
  "resources": [
    {
      "id": "vector-baseline-index",
      "type": "opensearch_index",
      "env": "OPENSEARCH_VECTOR_RECIPES_BASELINE_INDEX",
      "default": "recipes-vector-baseline",
      "used_by": [
        "baseline-vector-rag"
      ],
      "defined_in": "support/common/config.py",
      "lifecycle": [
        "Ingest replaces matching recipe IDs; query can create an empty index.",
        "Use the same environment override for ingest and query; ingestion CLI overrides do not persist."
      ]
    },
    {
      "id": "bm25-baseline-index",
      "type": "opensearch_index",
      "env": "OPENSEARCH_BM25_RECIPES_BASELINE_INDEX",
      "default": "recipes-bm25-baseline",
      "used_by": [
        "baseline-bm25-rag"
      ],
      "defined_in": "support/common/config.py",
      "lifecycle": [
        "Ingest creates the index and replaces matching recipe IDs."
      ]
    },
    {
      "id": "native-hybrid-index",
      "type": "opensearch_index",
      "env": "OPENSEARCH_HYBRID_INDEX",
      "default": "recipes-hybrid",
      "used_by": [
        "hybrid-rag-native"
      ],
      "defined_in": "support/common/config.py",
      "lifecycle": [
        "Stores text and vectors together; ingest and query can create it."
      ]
    },
    {
      "id": "recipe-bm25-index",
      "type": "opensearch_index",
      "env": "OPENSEARCH_RECIPE_BM25_INDEX",
      "default": "recipes-bm25",
      "used_by": [
        "hybrid-rag-ner-rerank",
        "governance-tiering"
      ],
      "defined_in": "support/common/config.py",
      "lifecycle": [
        "Shared with the paired recipe vector index; both must contain matching IDs and metadata.",
        "Task 5 writes all-hot tiers; task 6 replaces them with hot/lt. Re-ingesting task 5 undoes task 6 tier assignments."
      ]
    },
    {
      "id": "recipe-vector-index",
      "type": "opensearch_index",
      "env": "OPENSEARCH_RECIPE_VECTOR_INDEX",
      "default": "recipes-vector",
      "used_by": [
        "hybrid-rag-ner-rerank",
        "governance-tiering"
      ],
      "defined_in": "support/common/config.py",
      "lifecycle": [
        "Shares corpus and tier state with the recipe BM25 index; pair writes have no transaction.",
        "Embedding model and dimension must match the existing mapping and corpus vectors."
      ]
    },
    {
      "id": "audit-index",
      "type": "opensearch_index",
      "env": "OPENSEARCH_AUDIT_INDEX",
      "default": "recipes-audit-log",
      "used_by": [
        "governance-tiering",
        "operationalize-production"
      ],
      "defined_in": "support/common/config.py",
      "lifecycle": [
        "Governance records include question and generated answer; writes are best-effort.",
        "Production validation may attach a policy that later deletes this entire index based on index age."
      ]
    },
    {
      "id": "native-search-pipeline",
      "type": "search_pipeline",
      "env": null,
      "default": "hybrid-search-pipeline",
      "used_by": [
        "hybrid-rag-native"
      ],
      "defined_in": "support/common/opensearch_client.py",
      "lifecycle": [
        "Fixed cluster-wide name; index suffixes do not isolate it.",
        "Ingest PUTs chosen weights; every query PUTs defaults 0.3/0.7 again."
      ]
    },
    {
      "id": "audit-retention-policy",
      "type": "ism_policy",
      "env": null,
      "default": "recipes-audit-log-retention",
      "used_by": [
        "operationalize-production"
      ],
      "defined_in": "support/common/opensearch_client.py",
      "lifecycle": [
        "Fixed cluster-wide name; review an existing policy before reuse.",
        "Production validate attempts policy creation and attachment; HTTP 409 is accepted without updating its contents.",
        "The delete action removes the whole index at AUDIT_RETENTION_DAYS of index age; default 180."
      ]
    },
    {
      "id": "embedding-model",
      "type": "embedding_model",
      "env": "EMBEDDING_MODEL",
      "default": "sentence-transformers/all-MiniLM-L6-v2",
      "used_by": [
        "setup-environment",
        "baseline-vector-rag",
        "hybrid-rag-native",
        "hybrid-rag-ner-rerank",
        "governance-tiering"
      ],
      "defined_in": "support/common/config.py",
      "lifecycle": [
        "May download weights when first loaded; default output is 384 dimensions.",
        "Vectors are L2-normalized; preserve model/dimension consistency across ingestion and querying."
      ]
    },
    {
      "id": "ner-service",
      "type": "local_service",
      "env": "NER_SERVICE_URL",
      "default": "http://127.0.0.1:8000/ner",
      "used_by": [
        "setup-environment",
        "baseline-bm25-rag",
        "hybrid-rag-ner-rerank",
        "governance-tiering",
        "operationalize-production"
      ],
      "defined_in": "support/common/config.py",
      "lifecycle": [
        "Started manually from baseline-bm25-rag; no task or container startup automatically starts it.",
        "Service reads PORT/SPACY_MODEL from its process environment; client URL is separately configured.",
        "A failed request removes NER entity boosts but hard filters remain."
      ]
    },
    {
      "id": "llm-provider",
      "type": "model_endpoint",
      "env": "LLM_PROVIDER",
      "default": "bedrock",
      "used_by": [
        "baseline-vector-rag",
        "baseline-bm25-rag",
        "hybrid-rag-native",
        "hybrid-rag-ner-rerank",
        "governance-tiering"
      ],
      "defined_in": "support/common/llm_client.py",
      "lifecycle": [
        "Supported providers are bedrock (Anthropic Messages-shaped invoke_model) and openai (chat completions).",
        "Queries send prompts and retrieved text to the configured provider and can incur charges.",
        "Ingest and production operations do not invoke the LLM."
      ]
    }
  ],
  "tasks": [
    {
      "id": "setup-environment",
      "number": 1,
      "title": "Prepare the workspace",
      "goal": "Configure the shared Python environment, OpenSearch connection, LLM provider and optional local NER service.",
      "docs": "tasks/setup-environment.md",
      "reference": "references/setup-environment.md",
      "troubleshooting": "troubleshooting/setup-environment.md",
      "concepts": [
        "concepts/INFRASTRUCTURE_CHOICES.md",
        "concepts/EMBEDDING_MODELS.md"
      ],
      "requires": [],
      "source_files": [
        "support/validate_setup.py",
        "support/requirements.txt",
        "support/.env.example",
        "support/common/config.py",
        "support/common/__init__.py",
        "support/docker-compose.yaml",
        "support/Dockerfile.dev",
        "support/container-entrypoint.sh",
        "support/runtime_health.py"
      ],
      "commands": [
        {
          "id": "install-dependencies",
          "cwd": ".",
          "argv": [
            "python",
            "-m",
            "pip",
            "install",
            "-r",
            "support/requirements.txt"
          ],
          "prerequisites": [
            "A project-specific virtual environment is active."
          ],
          "effects": [
            "local_read",
            "local_write",
            "dependency_install",
            "network_read"
          ],
          "result": {
            "format": "human_text",
            "exit_codes": {
              "0": "pip reports successful installation."
            },
            "success": [
              "pip completes dependency installation."
            ],
            "limitations": [
              "This installs packages from configured package indexes; it is not an offline validation command.",
              "Nonzero exit codes are defined by pip; inspect its error output."
            ]
          }
        },
        {
          "id": "install-ner-model",
          "cwd": ".",
          "argv": [
            "python",
            "-m",
            "spacy",
            "download",
            "en_core_web_sm"
          ],
          "prerequisites": [
            "The shared Python dependencies are installed in the active virtual environment."
          ],
          "effects": [
            "local_write",
            "dependency_install",
            "network_read",
            "model_download"
          ],
          "result": {
            "format": "human_text",
            "exit_codes": {
              "0": "The model download/install command completed successfully."
            },
            "success": [
              "The spaCy English model package is installed."
            ],
            "limitations": [
              "Requires network access unless the package is already available through configured caches.",
              "Nonzero exit codes are defined by spaCy and its package installer; inspect their error output."
            ]
          }
        },
        {
          "id": "validate-workspace",
          "cwd": ".",
          "argv": [